{
  "schemaVersion": "fenrua.route-lifecycle.v1",
  "canonicalOrigin": "https://fenrua.ai",
  "reviewedAt": "2026-08-05",
  "records": [
    {
      "id": "home",
      "path": "/",
      "state": "current",
      "methods": ["GET", "HEAD"],
      "expectedStatus": 200,
      "destination": null,
      "canonical": "https://fenrua.ai/",
      "indexPolicy": "index-follow",
      "cacheClass": "html-current",
      "contentOwner": "public-platform",
      "replacement": null,
      "effectiveDate": "2026-07-14",
      "reviewDate": "2026-07-14",
      "evidenceIds": ["site-evidence-input"],
      "notes": "Canonical public overview and routing surface.",
      "routeClass": "html",
      "contentType": "text/html",
      "audit": true
    },
    {
      "id": "ai",
      "path": "/ai",
      "state": "current",
      "methods": ["GET", "HEAD"],
      "expectedStatus": 200,
      "destination": null,
      "canonical": "https://fenrua.ai/ai",
      "indexPolicy": "index-follow",
      "cacheClass": "html-current",
      "contentOwner": "ai-product",
      "replacement": null,
      "effectiveDate": "2026-08-05",
      "reviewDate": "2026-08-05",
      "evidenceIds": ["site-evidence-input"],
      "notes": "Public Fenrua AI development-direction route with explicit planned and not-available product boundaries.",
      "routeClass": "html",
      "contentType": "text/html",
      "audit": true
    },
    {
      "id": "roadmap",
      "path": "/roadmap",
      "state": "current",
      "methods": ["GET", "HEAD"],
      "expectedStatus": 200,
      "destination": null,
      "canonical": "https://fenrua.ai/roadmap",
      "indexPolicy": "index-follow",
      "cacheClass": "html-current",
      "contentOwner": "public-platform",
      "replacement": null,
      "effectiveDate": "2026-07-22",
      "reviewDate": "2026-07-22",
      "evidenceIds": ["site-evidence-input"],
      "notes": "Public BlackBox Protocol staged-direction and disclosure-boundary route.",
      "routeClass": "html",
      "contentType": "text/html",
      "audit": true
    },
    {
      "id": "architecture",
      "path": "/architecture",
      "state": "current",
      "methods": ["GET", "HEAD"],
      "expectedStatus": 200,
      "destination": null,
      "canonical": "https://fenrua.ai/architecture",
      "indexPolicy": "index-follow",
      "cacheClass": "html-current",
      "contentOwner": "public-platform",
      "replacement": null,
      "effectiveDate": "2026-07-14",
      "reviewDate": "2026-07-14",
      "evidenceIds": ["site-evidence-input"],
      "notes": "Current architecture overview.",
      "routeClass": "html",
      "contentType": "text/html",
      "audit": true
    },
    {
      "id": "kernel",
      "path": "/kernel",
      "state": "current",
      "methods": ["GET", "HEAD"],
      "expectedStatus": 200,
      "destination": null,
      "canonical": "https://fenrua.ai/kernel",
      "indexPolicy": "index-follow",
      "cacheClass": "html-current",
      "contentOwner": "public-platform",
      "replacement": null,
      "effectiveDate": "2026-07-14",
      "reviewDate": "2026-07-14",
      "evidenceIds": ["site-evidence-input"],
      "notes": "Security-kernel public evidence surface.",
      "routeClass": "html",
      "contentType": "text/html",
      "audit": true
    },
    {
      "id": "utilities",
      "path": "/utilities",
      "state": "current",
      "methods": ["GET", "HEAD"],
      "expectedStatus": 200,
      "destination": null,
      "canonical": "https://fenrua.ai/utilities",
      "indexPolicy": "index-follow",
      "cacheClass": "html-current",
      "contentOwner": "public-platform",
      "replacement": null,
      "effectiveDate": "2026-07-14",
      "reviewDate": "2026-07-14",
      "evidenceIds": ["site-evidence-input"],
      "notes": "Utility catalogue with stated maturity boundaries.",
      "routeClass": "html",
      "contentType": "text/html",
      "audit": true
    },
    {
      "id": "research",
      "path": "/research",
      "state": "current",
      "methods": ["GET", "HEAD"],
      "expectedStatus": 200,
      "destination": null,
      "canonical": "https://fenrua.ai/research",
      "indexPolicy": "index-follow",
      "cacheClass": "html-current",
      "contentOwner": "public-platform",
      "replacement": null,
      "effectiveDate": "2026-07-14",
      "reviewDate": "2026-07-14",
      "evidenceIds": ["site-evidence-input"],
      "notes": "Research registry index.",
      "routeClass": "html",
      "contentType": "text/html",
      "audit": true
    },
    {
      "id": "fenrua-521-public-evidence",
      "path": "/fenrua-521",
      "state": "current",
      "methods": ["GET", "HEAD"],
      "expectedStatus": 200,
      "destination": null,
      "canonical": "https://fenrua.ai/fenrua-521",
      "indexPolicy": "index-follow",
      "cacheClass": "html-current",
      "contentOwner": "research",
      "replacement": null,
      "effectiveDate": "2026-07-25",
      "reviewDate": "2026-07-25",
      "evidenceIds": ["site-evidence-input"],
      "notes": "Public Fenrua-521 evidence release reader with a source-repository fallback and declared release boundary.",
      "routeClass": "html",
      "contentType": "text/html",
      "audit": true
    },
    {
      "id": "research-pn521-cross-limb-borrow",
      "path": "/research/pn521-cross-limb-borrow",
      "state": "current",
      "methods": ["GET", "HEAD"],
      "expectedStatus": 200,
      "destination": null,
      "canonical": "https://fenrua.ai/research/pn521-cross-limb-borrow",
      "indexPolicy": "index-follow",
      "cacheClass": "html-current",
      "contentOwner": "research",
      "replacement": null,
      "effectiveDate": "2026-07-14",
      "reviewDate": "2026-07-14",
      "evidenceIds": ["site-evidence-input"],
      "notes": "P/N521 historical research record.",
      "routeClass": "html",
      "contentType": "text/html",
      "audit": true
    },
    {
      "id": "research-toolchain-evidence-lock",
      "path": "/research/toolchain-evidence-lock",
      "state": "current",
      "methods": ["GET", "HEAD"],
      "expectedStatus": 200,
      "destination": null,
      "canonical": "https://fenrua.ai/research/toolchain-evidence-lock",
      "indexPolicy": "index-follow",
      "cacheClass": "html-current",
      "contentOwner": "research",
      "replacement": null,
      "effectiveDate": "2026-07-14",
      "reviewDate": "2026-07-14",
      "evidenceIds": ["site-evidence-input"],
      "notes": "Toolchain evidence lock research record.",
      "routeClass": "html",
      "contentType": "text/html",
      "audit": true
    },
    {
      "id": "research-read-only-chain-observation",
      "path": "/research/read-only-chain-observation",
      "state": "current",
      "methods": ["GET", "HEAD"],
      "expectedStatus": 200,
      "destination": null,
      "canonical": "https://fenrua.ai/research/read-only-chain-observation",
      "indexPolicy": "index-follow",
      "cacheClass": "html-current",
      "contentOwner": "research",
      "replacement": null,
      "effectiveDate": "2026-07-14",
      "reviewDate": "2026-07-14",
      "evidenceIds": ["site-evidence-input"],
      "notes": "Bounded public observation research record.",
      "routeClass": "html",
      "contentType": "text/html",
      "audit": true
    },
    {
      "id": "verify",
      "path": "/verify",
      "state": "current",
      "methods": ["GET", "HEAD"],
      "expectedStatus": 200,
      "destination": null,
      "canonical": "https://fenrua.ai/verify",
      "indexPolicy": "index-follow",
      "cacheClass": "html-current",
      "contentOwner": "developer-platform",
      "replacement": null,
      "effectiveDate": "2026-07-14",
      "reviewDate": "2026-07-14",
      "evidenceIds": ["site-evidence-input"],
      "notes": "Local-first verifier foundation and fixtures.",
      "routeClass": "html",
      "contentType": "text/html",
      "audit": true
    },
    {
      "id": "developers",
      "path": "/developers",
      "state": "current",
      "methods": ["GET", "HEAD"],
      "expectedStatus": 200,
      "destination": null,
      "canonical": "https://fenrua.ai/developers",
      "indexPolicy": "index-follow",
      "cacheClass": "html-current",
      "contentOwner": "developer-platform",
      "replacement": null,
      "effectiveDate": "2026-07-14",
      "reviewDate": "2026-07-14",
      "evidenceIds": ["site-evidence-input"],
      "notes": "Developer orientation and reproducibility route.",
      "routeClass": "html",
      "contentType": "text/html",
      "audit": true
    },
    {
      "id": "toolchain",
      "path": "/toolchain",
      "state": "current",
      "methods": ["GET", "HEAD"],
      "expectedStatus": 200,
      "destination": null,
      "canonical": "https://fenrua.ai/toolchain",
      "indexPolicy": "index-follow",
      "cacheClass": "html-current",
      "contentOwner": "public-platform",
      "replacement": null,
      "effectiveDate": "2026-07-14",
      "reviewDate": "2026-07-14",
      "evidenceIds": ["site-evidence-input"],
      "notes": "Public toolchain inventory.",
      "routeClass": "html",
      "contentType": "text/html",
      "audit": true
    },
    {
      "id": "evidence",
      "path": "/evidence",
      "state": "current",
      "methods": ["GET", "HEAD"],
      "expectedStatus": 200,
      "destination": null,
      "canonical": "https://fenrua.ai/evidence",
      "indexPolicy": "index-follow",
      "cacheClass": "html-current",
      "contentOwner": "public-platform",
      "replacement": null,
      "effectiveDate": "2026-07-14",
      "reviewDate": "2026-07-14",
      "evidenceIds": ["site-evidence-input"],
      "notes": "Evidence registry route.",
      "routeClass": "html",
      "contentType": "text/html",
      "audit": true
    },
    {
      "id": "audit",
      "path": "/audit",
      "state": "current",
      "methods": ["GET", "HEAD"],